{
  "design_reasoning": {
    "score": 3,
    "reason": "All design decisions are grounded in existing ADRs and architecture. The design leverages ADR-008 (saga orchestration) and ADR-009 (state persistence) as the foundation. File-based attempt tracking aligns with existing patterns. The conversation accumulation pattern is justified by Devin CLI limitations documented in ADR-008. No over-engineering; design is minimal and focused on solving the specific problem (session resumption not viable). Each architectural decision includes explicit justification and basis.",
    "recommendation": "No improvement needed. This dimension is exemplary."
  },
  "workflow_changes": {
    "score": 3,
    "reason": "The workflow sequence is fully specified with 13 clear steps from initial execution through retry completion. Each step identifies the layers involved (SagaExecutor, Orchestrator, FileSystem, DevinWrapper). Data flows are explicit (prompts, outputs, verification feedback). The happy path is unambiguous and implementable. All acceptance criteria map to specific workflow steps: directory creation (steps 2), file capture (steps 3, 5, 7), retry detection (step 8), prompt composition (step 9), and traversal limit enforcement (step 13). Edge cases are handled implicitly through the design (first attempt has no previous context, token limits handled by agent, etc.).",
    "recommendation": "No improvement needed. This dimension is exemplary."
  },
  "interface_contracts": {
    "score": 3,
    "reason": "All contracts are fully specified with complete data shapes. The AttemptStateStructure contract defines the file-based state model with three files (input.txt, output.txt, verification.txt) per attempt. The invoke_step_with_saga_context contract specifies new parameters (saga_id, node_name, attempt_number). The retry_with_accumulated_context interaction pattern defines the complete flow with step-by-step data transformations. All workflow steps map to specific contract operations. Data shapes are explicit (accumulated_prompt, file paths, directory structure). Error handling is implicit through existing verification script mechanism.",
    "recommendation": "No improvement needed. This dimension is exemplary."
  },
  "layer_responsibilities": {
    "score": 3,
    "reason": "All responsibilities are clearly assigned with explicit rationale. SagaExecutor owns retry detection and attempt number determination (it has the node directory context). Orchestrator owns state file management and prompt composition (it manages step execution and state). FileSystem owns artifact storage (it's the persistence layer). Each responsibility is justified by 'where is the information available to act' principle. The design reuses existing components (traversal limits, verification scripts, enrichment dictionary) rather than creating new ones. No contradictions with existing architecture; design extends ADR-008 and ADR-009 patterns.",
    "recommendation": "No improvement needed. This dimension is exemplary."
  },
  "instrumentation": {
    "score": 3,
    "reason": "Four comprehensive instrumentation events are defined: attempt_number_determined, accumulated_prompt_composed, state_files_written, and retry_limit_enforced. Each event includes rich context (node_name, attempt_number, file paths, prompt sizes). Events cover all major workflow branches: initial execution, retry detection, prompt composition, and limit enforcement. Logging strategy is explicit: attempt numbers logged, prompt sizes logged (for debugging token limit issues), file operations logged, and limit enforcement logged. All error states (token limit overflow, traversal limit hit) are covered through event logging.",
    "recommendation": "No improvement needed. This dimension is exemplary."
  }
}
